{
  "$schema": "https://json-schema.org/draft/2020-12/schema",
  "$id": "https://placepulse.local/contracts/v1/media-object.schema.json",
  "title": "PlacePulse private media metadata",
  "type": "object",
  "additionalProperties": false,
  "required": [
    "schema_version",
    "media_id",
    "owner_id",
    "visibility",
    "object_key",
    "detected_mime_type",
    "size_bytes",
    "sha256",
    "state",
    "created_at"
  ],
  "properties": {
    "schema_version": { "const": 1 },
    "media_id": { "type": "string", "format": "uuid" },
    "owner_id": { "type": "string", "format": "uuid" },
    "visibility": { "const": "private" },
    "object_key": {
      "type": "string",
      "pattern": "^media/[0-9a-f]{8}-[0-9a-f]{4}-[1-5][0-9a-f]{3}-[89ab][0-9a-f]{3}-[0-9a-f]{12}/(?:original|derived/[a-z0-9_-]{1,32})$"
    },
    "client_filename": { "type": ["string", "null"], "maxLength": 255 },
    "detected_mime_type": { "type": "string", "minLength": 3, "maxLength": 127 },
    "size_bytes": { "type": "integer", "minimum": 1 },
    "sha256": { "type": "string", "pattern": "^[0-9a-f]{64}$" },
    "state": { "enum": ["pending", "accepted", "rejected", "failed"] },
    "created_at": {
      "type": "string",
      "format": "date-time",
      "pattern": "^\\d{4}-\\d{2}-\\d{2}T\\d{2}:\\d{2}:\\d{2}(?:\\.\\d+)?Z$"
    }
  }
}
