{
  "schema_version": 1,
  "media_id": "cf730c9b-439c-4dc7-80cd-a2929d15aafb",
  "owner_id": "78e30171-75d2-4324-a29e-a73b74dc0744",
  "visibility": "private",
  "object_key": "media/cf730c9b-439c-4dc7-80cd-a2929d15aafb/original",
  "client_filename": "photo.jpg",
  "detected_mime_type": "image/jpeg",
  "size_bytes": 2048,
  "sha256": "ba7816bf8f01cfea414140de5dae2223b00361a396177a9cb410ff61f20015ad",
  "state": "pending",
  "created_at": "2026-08-18T10:30:00Z"
}
